Classification,Sentences
1,"Outlook Having returned to year-over-year organic sales volume growth, we believe continued improvement in our manufacturing operations will return the Company to year-over-year earnings growth in the third and fourth quarter of 2017, concluded Mr"
1,"Outlook Smith continued, During our second quarter we normally experience lower shipment levels due to winter weather conditions impairing construction activity as well as a reduced number of shipping days"
1,"Over the last year, Moise has been instrumental in leading the growth of digital subscriptions and optimizing the organizational design of the company into a customer-centric model"
1,Over the next few quarters we expect gross margins to come down due to the recent turnover we experienced in managed document services with partial offset as we grow professional services
1,"Over the past few years, we have made significant investments that are driving our top and bottom line growth. We've expanded our customer base to over 200 customers and increased distribution by leveraging our domestic and international marketing and sales channels."
1,"Over the past years, Rob has served in leadership roles in sales, marketing, and services, and most recently helped organize our company around the high-growth IoT opportunity, said Heppelmann"
1,"Over time we do envision ETFs coming to market, once the regulated futures market is built and liquid, Chris Concannon, president and COO of the Chicago-based exchange operator, said on an earnings call today"
1,"Overall, however, we are strongly of the view that the current undemanding multiple more than compensates for any of these sort of issues, whether real or perceived, UBS says"
1,"Overall, revenue from media delivery solutions fell to $187M, but was offset by AKAM's expanding security business, with performance and security solutions revenue up 17% year-over-year, or 18% on a currency-adjusted basis, to $369M--60% of overall revenue"
1,"Overall, we continue to execute well, and although we are very pleased with our first half growth, we remain cautious entering the back half of the year given current market conditions"
1,"Page of PayMaya's growth is being sustained by strong uptake by millennials, various tactical promotions and strategic collaborations with top global tech brands like Uber and Paypal"
1,"Pairing the expertise of NTT Communications in managed services, and Microsoft's cloud technology, the solution will address businesses' need for agility, as well as the challenges of security and compliance in the cloud"
1,"Parkson Yip, COO E-mail: +852-Web:Compass Investor Relations Elaine Ketchmere, CFA+1-310-528-Web:View original content:http:news-releasescleantech-solutions-international-enters-into-sale-and-purchase-agreement-to-acquire-51-of-inspirit-studio-300544695"
1,"Partially offsetting factors supporting the rating include balanced fiscal and operating results, continued operating and capital support from Texas ('AAA'Stable), and a diverse revenue mix"
1,"Patent licensing drives most of Qualcomm's operating profits, but Broadcom CEO Hock Tan told investors on a conference call hosted by Bernstein last week that Qualcomm's business model is angering customers, thus providing an opportunity to rationalize and restructure the licensing business"
1,"Paul Donahue, President and Chief Executive Officer, stated, Merle's is a leading automotive distributor in the greater Tucson area, and this strategic acquisition significantly enhances our automotive store footprint and competitiveness in the Arizona marketplace"
1,"Paul Meister, who has been overseeing the day-to-day operations of the Company on an interim basis, will continue in his role as Executive Vice Chairman of the Revlon Board of Directors"
1,PCT - Success story continues; significant growth in semiconductor market The lasting high demand in the semiconductor market ensured another record six months for Plasma Control Technologies (PCT)
1,People expecting the Canadian government to step in to bring a quick end to the strike at Canadian Pacific Railway with back-to-work legislation could be in for a disappointment
1,"Pete Petit, Chairman and CEO, stated, We are pleased with the progress we have made in our initiatives, and expect to continue to benefit from them throughout the upcoming year and beyond"
1,"Pl Ryfors, acting CEO, Episurf MedicalAbout Episurf Medical Episurf Medical is endeavoring to bring people with painful joint injuries a more active, healthier life through the availability of minimally invasive and personalized treatment alternatives"
1,"Pl Ryfors, CEO Episurf Medical, says that we have received very encouraging feedback from leading surgeons in Hong Kong, confirming that Episealer will help them to treat patients in the so -called treatment gap"
1,"Pl Ryfors, CEO, Episurf Medical About Episurf Medical Episurf Medical is endeavoring to bring people with painful joint injuries a more active, healthier life through the availability of minimally invasive and personalised treatment alternatives"
1,Polygiene and 2XU are collaborating on odorless compression garments for elite athletes and joggers Polygiene and the global sportswear brand 2XU (two times you) have established cooperation concerning Polygiene treatment of the compression garments to be launched in 2XUs coming collections during 2017
1,"Potential future business development collaborations, pipeline expansion, and investment in biologics manufacturing capabilities could impact the Company's future capital requirements"
1,"Powerful drivers that will support our growth With a solid structure and a production team that is appropriately sized to satisfy the demand from television channels and digital platforms, Xilam is ready to move to the next level"
1,"President and Chief Executive Officer Eugene Suyu states: We are extremely disappointed with the dispute over the sale during the third quarter, and determined that instead of pursuing legal action, we would take back the product and focus on delivery and sales to new and existing customers moving forward"
1,"Prices have stayed between about $1,and $1,this year, moving within that range based on safe-haven buying, swings in the dollar and worries about the prospect of higher interest rates"
1,"Prior to joining Cisco, Rowan spent many years in the Internet Security industry, and led Symantec's sales, marketing and product development teams as the Group President, focusing on their cloud strategy"
1,"Prior to Medidata, Capone held multiple senior leadership positions at ADP, one of the world's largest B2B cloud services providers, delivering critical services to over 600,companies and million of their staff members worldwide"
1,"Protecting the group's capital base through withdrawing the interim dividend and in all likelihood the full-year dividend is the appropriate response to maintain the highly valuable franchises of Vanquis Bank, Moneybarn and Satsuma"
1,"Pullbacks look like a buying opportunity in my opinion, as the energy space has been getting a lot of love with talk of a far more balanced market in and prices in US crude likely to hold US$and maintain a new trading range, IG says"
1,Purlucid has an active research and development program and its CEO holds academic positions at multiple Canadian universities where he promotes advanced research in water treatment and environmental engineering
1,"Quarterly Comparison Three Months Ended Mar 31, Dec 30, Apr 1, (in thousands, except EPS) Q2F18 Q1F18 Q2F17 Revenue $ 698,$ 677,$ 604,Gross profit 52,63,63,Operating income 17,31,32,Net income (loss) 12,(98,493) 29,Diluted earnings (loss) per share $ $ (2"
1,"Quarterly Financial Segment Summary -- Computing and Graphics segment revenue was $million, up percent year-over-year, driven by demand for graphics and Ryzen desktop processors"
1,"Raj Chakraborty, who comes from Accenture PLC, will join the firm's senior management committee and be responsible for creating and implementing an enterprise-wide digital business transformation strategy focused on improving the customer experience"
1,"Ralf Zastrau, CEO of Nanogate SE, said, Nanogate has laid a substantial foundation for corporate development by issuing several tranches of promissory note loans and with new syndicated financing"
1,"Rather than simply buying and holding the bonds in an index, active managers select the bonds in a portfolio and can therefore target opportunities for alpha, while aiming to avoid volatility"
1,"Rather, it will defer SpraberryWolfcamp drilling completions that were planned for this year into 2018, causing the company to decrease its capital spending and expect full-year production growth closer to the lower end of its 15% to 18% guidance"
1,"Raymond James's Simon Leopold reiterates an Outperform rating on Juniper stock, while trimming his target a buck, to $34, noting that Juniper's revenue from cloud rose really fast the first half of the year, so maybe this is just the  front-end-loaded nature of the market: Cloud revenue grew 29% y/y in 1H17, outpacing the 3% y/y growth in the legacy service provider and enterprise verticals"
1,"RBC Capital Markets said Northern Star's fourth-quarter production of 154,troy ounces beat its own estimate by 23%, and was due to an unexpectedly strong performance at the Jundee gold mine"
1,"Realize the true power of cloud to support new digital business models Hong Kong is expected to see the strongest growth in Azure Stack adoption (61%), followed by Malaysia and Singapore at 51% and 49% respectively(i) "
1,Red Cask Canadian Whisky in certain markets across Canada and will be continuing to launch new offerings from the Wayne Gretzky Estate Winery and Craft Distillery in the coming year
1,"Red Hat OpenShift Container Platform provides the Kubernetes-centric basis for our Accenture DevOps Platform (ADOP), helping clients fuel digital transformation efforts through innovative technologies as well as best practices and our expert services"
1,"Red Stone Equity's COO Bob Fein commented, As the LIHTC industry faces some headwinds and uncertainty in 2017, it is entirely appropriate to celebrate our achievements of the prior year"
1,"Remove junk files, update the drivers and optimize the registry With computers functioning so integrally on both business and personal levels, it's easy to get frustrated when performance erodes and valuable time is unnecessarily consumed, said Jerry Li, General Manager of R&D Center of PC Products, Cheetah Mobile"
1,"Renault's third-quarter revenue beat expectations slightly, but the limited contribution of operating leverage puts into question revenue quality, say Goldman Sachs analysts"
1,"Restated for the accounting impact of the expense associated with these two share plans and the related social security charges, operating income for would have totalled EUR million, for an operating margin of 35"
1,"Retail buyers seeking brands which drive traffic, and increase departmental sales, are authorizing the brand, shelving CELSIUS alongside traditional energy set competitors"
1,"Revenue amounted to EUR million in the second quarter (same quarter of previous year: EUR million), bringing it to a total of EUR million in the first half of the year (previous year: EUR million; down 9"
1,"Revenue grew over 5,000% year over year when compared to year ended and Gopher has further developed its asset base, which is expected to support future operations and growth"
1,Revenue here nearly tripled year over year to $milliona notable accomplishment given that Nvidia's new Volta chip still was coming into full production during the quarter
1,"Revenue in the fourth quarter and full fiscal year exceeded the high end of our guidance range, driven by continued growing global demand for our products and services and operational execution in sales and service delivery, stated Tom Sabol, Rimini Street CFO"
1,"Revenues in Southeast Asia reached a new record, while in the Middle East the drop in sales suffered in was reversed despite continued, adverse political developments and persistently low oil prices"
1,"Revenues increased around 7% excluding the effect of the change in mix in Managed Access towards programmes where the product is provided by the pharmaceutical client free of charge, and the termination of a large Global Access low margin commercial contract, which was inherited with the Idis acquisition"
1,Reynolds and the terms and conditions were approved by the independent members of the Board of Directors and the Compensation Committee under NASDAQ Listing Rule 5635(c)(4)
1,"Risk is on this morning because traders are cheering what they expect to be a victory for the EU project as Macron ascends to the Elysee Palace after next month's final vote, adds McKenna"
1,Road builders in India have been benefitting from the increased spending on road projects as the government plans to improve existing highways and speed up goods movement
1,Rockoff Novartis AG Chief Executive Vasant Narasimhan said the company made a mistake agreeing to pay Trump lawyer Michael Cohen $million for what Novartis has described as his insight into health-care policy
1,Rodgers's solicitation of proxies to vote a consent on the Company's solicitation of consents to remove cumulative voting and with respect to certain governance matters (the Cypress Consent Solicitation)
1,"Routing is to an extent the China effect, he indicated, while security is turning a corner albeit slowly: In routing, it's a function of the market, it's a sort-of a flattish market"
1,"Rowan's valuable domain experience in cloud technologies and the contact center market will be a huge benefit to Five9 and we're really fortunate to gain a leader with his experience, talent and vision"
1,Royal Philips NV returned to a net profit in the fourth quarter as the Dutch health-technology and consumer-products maker reported a pickup in sales but said it sees elevated uncertainty in its markets
1,"Said on Monday that its fourth-quarter revenue was up 29% on the previous year, and said annual revenue had exceeded billion pounds ($billion) for the first time"
1,"said strong demand for new homes and higher selling prices drove earnings growth in the most recent quarter, as the nation's largest home builder reported it has so far shaken off concerns about rising interest rates and construction costs"
1,"said strong sales of its Switch game machine would drive a big jump in profit for this fiscal year, affirming bullish forecasts by investors that have pushed the stock up"
1,"said Thursday it was cutting 12,jobs in its power business, or nearly 20% of the unit's workforce, as the conglomerate slashes costs and battles overcapacity in its core business"
1,Saint Gobain reports its 1Q sales on Thursday and analysts at Deutsche Bank expect the negative effect of fewer working days and cold weather to limit growth during the quarter
1,"Sales increased 9.2% to $69.2 million in the first quarter of 2019 from $63.4 million in the first quarter of 2018. We increased our sales year-over-year, mainly due to the $7.5 million revenue recognition from Astellia"
1,"Sales increased in most of the markets, but decreased in Sweden where the Building Solutions product area had particularly large project deliveries during the corresponding period previous year"
1,"Santarelli, meanwhile, is sticking with Wynn Resorts stock -- his top pick -- arguing that a combination of operating leverage, share gains, and a sizable amount of free cash flow available for dividends means the stock can continue to outperform"
1,"SAP is winning big and we have enormous confidence in our accelerated ambition! - Bill McDermott, CEO SAP is consistently delivering on its promise and achieved all raised guidance metrics for the full year"
1,"Saudi Arabia, Kuwait and Angola have reduced their production more than they committed at a November summit that saw the cartel commit to its first output cut in eight years"
1,"Says the NYT: The Russian interest in the normally wonky technical sessions has caused concern among other delegations, who worry that individual countries could push standards that would make the security of the blockchain technology vulnerable to surveillance and attack"
1,SBB's earlier arrangement of using a related-party property management company has now been taken in-house and the CEO is prepared to widen the equity base with institutional investors
1,"Scaling up our enterprise smart glasses business in has come with many challenges, however despite temporary headwinds in manufacturing and product availability, this quarter represents our third consecutive quarter of record revenue, said Paul Travers, President and Chief Executive Officer of Vuzix"
1,"Schlotman says Kroger, the US's largest grocer, will take until the end of January to evaluate the implications of the tax plan before deciding how to use the additional cash if it passes"
1,Schmidt to Step Down as Alphabet Executive Chairman Google parent Alphabet said Eric Schmidt will step down from his post as executive chairman in January and transition to a role as technical adviser
1,Scott Price is joining the parcel UPS and will be tasked with driving and facilitating organizational change to help UPS find ways to grow profitably in existing businesses and find new areas to target as well
1,"SEB's Benefits processing solutions also include a fully automated, content-rich health and wellness platform, document management solutions, standalone fraud and analytics solutions and administration and underwriting solutions, which automate the application, underwriting and administration of new insurance product sales"
1,"Second, a decrease in sales of approximately $620,or 12% of Q1 sales to the former master distributor of our Kong product, due to the termination of our master distributor agreement with them"
1,"Second, we grew our assets under management to $444 million, an increase of 13% from $393 million as of Q2 and up 31% from $339 million as of the same time last year. From a longer term perspective, our current AUM reflects 186% increase from $155 million over the past five years. This quarter continues to demonstrate the success of our growing origination platform with a healthy $74 million of originations, including investments in one new portfolio company, bringing the total to eight new platforms since May"
1,"Secured Acre Site for Planned HEBioT Facility in New York State - In Q2 2017, the Company entered into an agreement to acquire a site in the town of New Windsor, located approximately miles north of New York City, for $million, subject to certain terms and conditions"
1,"service sector slowed in February, according to a report Friday that also said business confidence also slipped to the weakest point since the November presidential election"
1,"Seth is an energetic, digitally savvy leader with a proven track record for transforming great brands, and we are excited for him to join the executive team and help lead the organization"
1,SFO Director David Green told Risk & Compliance Journal this week that the agency is moving into high gear to resolve the various investigations of bribery and corruption at large global companies on its books
1,"shale basin, which has actually hampered companies like Haliburton to profit, as demand has overwhelmed rail capacity and a shortage of trained truck drivers has led to bottlenecks and cost increases"
1,Shapiro qualified as an English solicitor and practiced corporate law in the United Kingdom for one of London's leading commercial law firms before pursuing a 25-year career in investment banking
1,Shares in satellite services company SES are down after the company disclosed CEO Karim Michel Sabbagh was leaving to spend time with his family and to pursue new interests
1,"shares plunged as much as 20% after the company said its quarterly loss more than tripled, disappointing Wall Street again as it failed to significantly grow the number of people using its app daily"
1,"Sharing uplifting and educational stories is also important, as many people falsely assume, for example, that all technology jobs require advanced skills and education, Ms"
1,She began her career as a talent manager for the UK-based talent management and production company Avalon where she assumed responsibility for Avalon's television business development and M&A initiatives
1,"She says the EU is taking into consideration recently announced US sanctions against Russian individuals, including Gazprom chairman Alexei Miller, but that they would try to keep what happens geopolitically strictly apart from the case specifics since the details of the case are what would eventually be scrutinized in court"
1,"Shell Profit Slips to Lowest Level in More Than a Decade Royal Dutch Shell PLC's annual profit tumbled to the lowest level in more than a decade, reflecting a tough year for an industry hit hard by low oil prices"
1,"Sigfox partners ?? including silicon vendors, device makers, design houses ?? and customers will now have access to the expertise of the Kudelski Group's IoT Security Center of Excellence to optimize the security around the deployment of Sigfox-enabled products and better protect the related data"
1,"Similar to last quarter, our consumer portfolio experienced growth across all categories, including mortgage HELOC, lending partnerships and credit card. From a geographic standpoint, our metro markets continue to drive a large share of overall loan growth. Total average loans grew $304 million sequentially. Compared to the same quarter a year ago, average loans grew $1.01 billion or 4.1%. We continue to be pleased with the balance loan composition and diversification of our balance sheet."
1,"Since closing the acquisition, the MagneGas executive team has completed its initial restructuring of the San Diego operations and has doubled the sales team to take full advantage of growth opportunities in the local market"
1,"Sloan said with financial advisers, despite anecdotes of problems, attrition has improved 24% year-over-year and productivity from existing financial advisers is up about 7% year-over-year"
1,"SMB and Midmarket IT Enterprises Find Themselves on Both Sides of the Maturity Spectrum, But Steady Move Towards Increased Maturity According to Kaseya's research, percent of respondents classify their IT organisation as being at one of the first three, less mature levels on the IT Management Maturity Model: Reactive, Efficient, or Proactive"
1,Smithfield's numerous discussions with RPM over the past several months focused exclusively around one issue: RPM's inability to deliver on the track and the organization's repeated failure to present a plan to address its lack of competitiveness
1,"So in summary, we are putting in the foundations for accelerated revenue, new software, new business development processes, expanded resources, and as we start to see the signs of that growth with new customers, re-acquired customers, and expanded agreements, we expect to see increases in revenue growth and profitability near-term"
1,"So, first and foremost, I'd like to talk about our revenue growth. We posted first quarter revenues of $25.3 million. This is a Company record. It represents approximate increase year-over-year of a 186% compared to Q1 of last fiscal year and a consecutive Q4 to Q1 increase of 26.5%, and this is significant because historically there's not been much of a consecutive increase in Company history between Q4 and Q1 due to less selling days in the period and also due to some seasonality."
1,"Some of the statements contained in this release are forward-looking statements, such as estimates and statements that describe the Issuer's future plans, objectives or goals, including words to the effect that the Issuer or management expects a stated condition or result to occur"
1,"Speaking to other aspects of third quarter performance, Petit added, We had very strong cash flow from operations and expect to report continued progress in our Days Sales Outstanding (DSO)"
1,"Specifically, over the coming months and quarters we expect to: -- Increase origination volume directly from farmers; -- Lower fixed cost per unit handled by continuing to increase volumes throughout our network; -- Extend our reach to new regions in the U"
1,"Stefan Dhmen, CFO of va-Q-tec AG, explains the growth dynamic, the results of operations during the first nine months of 2017, and current trends in Q4_:_ _Behind us lie nine months of strong growth in our Products business and strong growth in our Services business"
1,"Stewart served as Director of SEC Reporting and Technical Accounting at Raptor Pharmaceuticals, Vice President of Technical Accounting and Reporting at Redwood Trust, and as an Auditor at Deloitte"
1,"Still, it notes Concho's bigger scale may mean they get viewed differently by investors than in the past, with the most notable difference between today's smaller-cap and larger-cap producers being a greater focus on returning cash to shareholders from the large-caps"
1,"Still, it views the current headwinds as temporary and any decline in share price is a buying opportunity, as it remains positive on Man Wah's long-term business fundamentals"
1,"Still, losses have been contained when compared with the debt of Catalan  Deutsche Bank changes its call on how the European Central Bank's QE tapering will play out, expecting a steeper cut but a longer extension"
1,"Stillfront operates through eight near-autonomous subsidiaries: Bytro Labs in Germany, Coldwood Interactive in Sweden, Power Challenge in the UK and Sweden, Dorado Online Games in Malta, Simutronics in the United States, Babil Games in UAE and Jordan, eRepublik in Ireland and Romania and OFM Studios in Germany"
