Classification,Sentences
0,"More from his note: With a 12-month time horizon, we believe BHGE has (1) inferior exposure to the most attractive investment themes vis-a-vis other large-cap options and (2) to prove that it can ramp on cost synergies without painful offsets, keeping us on the sidelines"
0,"Moreover, Sharp's now trades with an enterprise value equal to times its expected earnings before interest, tax, depreciation and amortization, much higher than LG Display's times and Japan Display's times, according to S&P Global Market Intelligence"
0,"Morgan Stanley's Adam Parker and team explain: Ultimately, a key to the US stock market over the coming weeks will be how believable the reflation assumptions are that have begun to be priced into markets"
0,Mortgage-giants Fannie Mae and Freddie Mac will retain some of their quarterly earnings as part of an agreement between the Trump administration and their regulator to allow them to build a small capital buffer against future operating losses
0,"Mosesmann, who has a Sell rating on Intel shares, notes that The Street applauded the leak as a sign strength and leadership which is of course a valid interpretation"
0,"MOSUL EMERGES FROM ISLAMIC STATE, ONE BUSINESS AT A TIME As Iraqi security forces drive Islamic State from cities such as Mosul, commerce is kicking in, a first step toward rebuilding the economy amid vast destruction"
0,"Move good for AWS rivals? The nudge from Wal-Mart has been pretty consistent, said Judson Althoff, executive vice president in charge of Microsoft's global sales to business customers"
0,Munich Re: A Reinsurer With Cushion to Withstand Hurricane Damage Investors should see Munich Re's profit warning after Hurricanes Harvey and Irma as a buying opportunity
0,"MUST READS Brexit Transition Deal Poses Questions for the EU: The British government's apparent agreement that it will seek a post-Brexit transitional deal with the EU is aimed at easing business uncertainty, but companies still have no idea what rules will govern the economic relationship, write Laurence Norman and Stephen Fidler"
0,"MUST READS FROM WSJ CITY Banks in the UK could be on the hook for EUR15 billion in costs to relocate certain activities to Europe after Brexit, according to a study by a finance trade groupa tab that could weigh on bank profits for years"
0,My best assessment is that there's more slackthere are more unemployed people out there that are not counted in the national statistics -- and people's expectations for inflation have been drifting lower
0,"national security due to the potential transfer of intellectual property to the foreign acquirer, the Chinese government's role in supporting this transaction, the importance of semiconductor supply chain integrity to the United States Government, and the use of Lattice products by the United States Government"
0,"Nearly two-thirds of workers said they were less likely to purchase goods and services from a potential employer who treated them poorly during the recruiting process, finds a new survey from consulting firm Future Workplace LLC and human-resources software company CareerArc Group LLC"
0,"Nearly two-thirds of workers say that they're less likely to purchase goods and services from a potential employer who treated them poorly during the recruiting process, finds a new survey from consulting firm Future Workplace LLC and human-resources software company CareerArc Group LLC"
0,Neither the TSX Venture Exchange nor its Regulation Service Provider (as that term is defined in the policies of the TSX Venture Exchange) accepts responsibility for the adequacy or accuracy of this release
0,"Netflix Signs 'Scandal' Creator Shonda Rhimes Netflix has recruited prolific television producer Shonda Rhimes, the creator of ABC hits such as Scandal and Grey's Anatomy, the clearest sign yet of an arms race for talent between new and old entertainment industry giants"
0,"New Car Sales Fall for Fourth Month In a Row -- Financial Times Business Group Urges Cabinet to Agree on Brexit Transition -- BBC News Brexit: Trade Envoys' Views on EU 'Irrelevant' -- BBC News For breaking news and intelligence on Brexit, finance, markets, deals and people from London, download WSJ City for iPhone or Android smartphone"
0,"New solutions based on state-of-the-art technology In April 2017, Datacolor launched ColorReaderPRO, an ultra-portable, Bluetooth connected color measurement device that works standalone or connected to the ColorReaderPRO mobile app, available for iPhone or Android?? smartphones"
0,"New Travel Ban Likely to Exempt Those With Visas: President Donald Trump plans to sign a revised executive order banning travel, which is likely to apply only to future visa applicants from majority Muslim countries tabbed as terror risks"
0,"New York State United Teachers, which has questioned the accuracy of state testing and expressed concerns about potential data breaches in computer-based exams, was quick to criticize the rollout"
0,"Next on her roster: a fashion scientist; the head of industrial design at virtual-reality company Oculus, where she also once worked; an artisan shoemaker; and an orthopedic surgeon"
0,"Nicolas Martinez Carranza, MD, PhD, performed the very first surgery with the Episealer knee implant in 2012, after years of pre-clinical research that formed the basis for the development of the implant and associated surgical instruments"
0,"Nine years after the recession, the pace of home construction remains more than 10% below normal rates, and there was just months worth of inventory on the market in January, just above December's record low of months"
0,"Nokia Mobile Networks Chief to Leave in Strategic Shake-Up Nokia is shaking up it core telecoms-equipment unit, as it struggles with slowing demand and a raft of new competitors"
0,"Nonetheless, MMA is comfortable advising subscribers to approach the new year expecting an uptick in default activity as emergent state budget gaps belie tax and fee revenue weakness across the government spectrum and, because of more aggressive high yield underwriting in (see OUTLOOK 1/3/17) a large universe of unseasoned project financings is poorly prepared for economic setbacks"
0,"Not Merging the Mac and the iPhone For the last portion of his presentation, Federighi tells the audience that Every year, people keep asking, Are you merging iOS and MacOS? No! he says, to much laughter"
0,"Not only will the flood of Snap supply likely outpace demand, but it will make it easier for short sellers to bet against Snap as the cost to borrow has been expensive and the market smells blood in the water with Snap, he writes"
0,"Nothing is spelled out by the screenplay, which the director and Christine Angot adapted from Roland Barthes's A Lover's Discourse, though all the information we need is available -- and available to Isabelle, if she chooses to use it and thereby fulfill the sunny optimism of the title"
0,"Novartis, one of the world's biggest drug companies by sales, said its aim by hiring Essential Consultants was to gain better understanding of Trump administration policy-making, especially regarding matters like the status of the Affordable Care Act"
0,Now the industry and its regulators have a new tool to help address the problem: software developed by scientists at Stanford University that can identify fault lines in danger of being triggered by wastewater disposal deep underground
0,"Now the term could mean that hackers have penetrated a corporate network to observe, perhaps planning a future assault, said Jennifer Archie, a partner at the law firm Latham & Watkins LLP"
0,"Now, more than three years since the Episealer surgery, the patient continues to demonstrate significant pain and outcome score improvements that have also enabled a return to sporting activities"
0,"Nowa decade from the onset of the crisis and nearly seven years since the passage of the Dodd-Frank Act and international agreement on the key banking reforms--a new question is being asked: Have reforms gone too far, resulting in a financial system that is too burdened to support prudent risk-taking and economic growth? [The entire text of Yellen's speech can be read on the Federal Reserve's Web site"
0,"Nvidia's technology wasn't blamed for the incident, though the company has still elected to temporarily suspend tests of the vehicles using its platform while investigating the matter"
0,"NYSE Said to Be Considering 'Inverted' Model for New Exchange NYSE has approached market participants about launching a so-called inverted exchange, a move that would borrow from the playbook of rivals Nasdaq and Bats Global Markets"
0,"Obama included a pardon for Willie McCovey, a member of the Baseball Hall of Fame who pleaded guilty in to filing a false tax return and was sentenced to probation and a $5,fine in 1996"
0,"Odebrecht Bribery Plea Muddies Colombia's Big River Project Brazilian construction firm Odebrecht's admission of extensive bribery has frozen an $862-million contract to dredge the Magdalena River, leaving many frustrated and drying up financing for Colombia's ambitious infrastructure program"
0,"OFAC never reveals the specific basis for a sanctions designation, and the agency makes it difficult for a blacklisted party to retain a lawyer because obtaining authorization to make payments to an attorney is onerous, he said"
0,OFAC separately on Thursday imposed sanctions on two property management companies it said were linked to the leader of a Mexican drug trafficking organization who was blacklisted in 2015
0,Officials at all three companies have in recent months expressed concerns that the Pentagon could choose the cheapest offering rather than the one with the best technical merits
0,"Officials at the Consumer Financial Protection Bureau told Business Insider's Allan Smith that they are confused, worried about their employment, and uncertain about the future after a messy battle between its former director and the Trump administration over who is leading the agency"
0,"Oil Firms on Signs of OPEC Cuts Crude-oil futures extended gains, as signs that major oil producers have followed through on a deal to cut production offset expectations that other countries will pump more"
0,"Oil Prices See Biggest Decline Since March Oil prices had their biggest drop since March, as new government figures stoked worries rising output from shale formations could throw the oil market further out of balance"
0,"On average, directors of Fortune companies estimate that fewer than four people inside and outside their company have the management expertise and industry-specific knowledge to step into the CEO role and run it as well as its current leader, according to a Stanford University survey of such directors"
0,"On the other hand, the US dollar index was lower offsetting what could have been a much stronger round of selling in the oil pits, said Dominick Chirichella, an analyst at the Energy Management Institute, in a Monday note"
0,"On Wednesday, minutes from the Federal Reserve's March meeting showed the central bank plans to raise rates two or three more times this year as the economy picks up steam"
0,"One bright spot for several banks was the business of funding equities trades for hedge funds, which makes Deutsche's major loss of ground there look doubly painful"
0,"One example are Internet-of-Things sensors and devices, which have not only created new points of entry for attackers, he said, but have also re-introduced some old vulnerabilities that were thought to be secure"
0,"One of the concerns appears to be whether the government will take a heavier hand with regulation, something that has hurt not only Equifax but TransUnion ( TRU) and Experian ( EXPGY) as well"
0,"One of the more frustrating is the paucity of insurance adjusters, which is threatening to anger policyholders and potentially delay the state's rebuilding efforts, WSJ reports"
0,"One recent source of worry among strategists and investors has been the growing gap between Libor, which is set amongst banks, and the overnight index swap rate, which is determined by central bank rates"
0,"Only 14% of 2,businesses surveyed by the Financial Conduct Authority believed the regulator was doing a good job explaining how best to prepare for Brexit"
0,Only Hitachi Data Systems powers the digital enterprise by integrating the best information technology and operational technology from across the Hitachi family of companies
0,"Operating Update First Quarter Marcellus Shale -- Antero completed and placed on line horizontal Marcellus wells during the first quarter of with an average lateral length of 9,100' and a 30-day rate of MMcfed (with 25% ethane recovery) on choke"
0,"Operations Updates Production Capacity As of March 31, 2017, the Company's in-house, annualized production capacities were 1,MW for ingot, 1,MW for wafer, 4,MW for cell and 4,MW for module"
0,"Opinions on Dodd-Frank Sharply Divided by Politics Republican plans to eliminate the Dodd-Frank Act are popular among the party's base, but not among Democrats or independents, a new survey shows"
0,"Oracle understands that startups are at the heart of innovation, and through this program we aim to give startups access to extensive resources and support when they need it most"
0,"Originally from Sweden, Spotify has both disrupted and revived the global music industry by convincing some million subscribers to pay an average of roughly $a month for as many tunes as they can listen to through its apps"
0,"Osanai, who used to work at Sony, said the Aibo can also help foster internal collaboration because technologies used in the robot come from a wide range of Sony's businesses"
0,"Other executives indicted include Eni's former chief executive Paolo Scaroni, Eni's CEO at the time of the deal, and Malcolm Brinded, Shell's global exploration and production chief at the time of the deal"
0,"Others nursing bruises today include Anthem's advisers at UBS , which had $million contingent on the deal closing, and Credit Suisse , which was still waiting for $million of its $million fee"
0,"Our APxJ Telecoms Portfolio comprises Telecom Indonesia ( TLK) (20%), XL Axiata in Indonesia (10%), Bharti Infratel in India (15%), China Telecom ( CHA) (15%), HKT Trust in Hong Kong (20%) and Korea Telecom (20%)"
0,"Our brands create and distribute content across our media portfolio, offering integrated marketing, media, and business services to consumers and advertisers, including digital solutions and advertising opportunities"
0,"Our results suggest that achieving any given global temperature stabilization target will require steeper greenhouse gas emissions reductions than previously calculated, the paper states"
0,"Our take is that while the retailer will take a hit to 3Q EPS and its stock, we are pleased by the steps JCP has taken to revamp its women's offering, including providing a much needed reset, with a greater focus on casual and contemporary, as well as athletic and athleisure while simultaneously scaling back career-wear, traditional, and other under-performing areas/brands"
0,Our TOO(R) Test represents a unique offering with the ability to add significant value to the continuum of care for cancer patients and greatly enhance our biopharma partners' development efforts
0,paid nearly $million in fines and compensation to drivers to lift a temporary suspension of its services in the Philippines following a dispute with regulators that had left the firm scrambling to protect its market share in one of its best-performing markets in Southeast Asia
0,Parliamentarians are asking Daniele Nouy a number of questions about the rescue of Spain's sixth-largest lender by Banco Santander after the ECB declared the former likely to fail
0,parliament's treasury committee that she didn't reveal her brother worked in a senior role at a British lender regulated by the BOE when she joined the bank as chief operating officer more than three years ago
0,"Particularly in the summer months, Trump issues and weather issues will be the primary drivers, both are hard to predict, said Mike Jubinville of ProFarmer Canada in Winnipeg"
0,"Patrick Daly, CPA and partner at Citrin Cooperman in New York, tells Financial Advisor that wealthy clients may want to consider selling second and third homes if they were acquired in order to receive tax benefits in past years"
0,"Peltz's Trian Fund Management earlier Wednesday said it believed P&G had decided to review and challenge the results, saying it was disappointed that the company continued to waste further time and shareholder money contesting the official tabulation of the independent inspector"
0,Performance targets and capital guidance 2018EURCost  income ratio1 Profitability & growth1 Capital & resource guidance Group <75% 15% RoTE excluding DTAs2 13% CET1 capital ratio (fully applied) 3
0,"Peter Wilkes Lionsgate (310) 255-Or Cristina Castaeda Lionsgate (310) 255-To view the original version on PR Newswire, visit:http:news-releaseslaura-kennedy-promoted-to-coo-of-lionsgate-television-group-300442350"
0,"petroleum assets are non-core and it was looking to exit, a win for investors who otherwise may have been disappointed by a result viewed as a little soft by analysts"
0,"PG&E is grateful to the City of San Francisco, San Francisco Fire Department, San Francisco Police Department, San Francisco Department of Emergency Management and the San Francisco Municipal Transportation Agency for their cooperation during this incident and to its customers for their patience as it worked to make repairs and restore power"
0,"PG&E Safely Restores Power to San Francisco, Thanks Customers for their Patience; Substation Scheduled for Modernization SAN FRANCISCOApril 21, 2017 Pacific Gas and Electric Company (PG&E) has safely restored power to all 88,customers impacted by a major power outage in San Francisco today"
0,"Pharmaceutical companies have tried to change the trend, but the history of failed weight-loss drugs is long and painful, most notably the withdrawal of Fen-Phen from the market in 1997, after the drug was found to cause heart valve damage"
0,"Ping An Healthcare's debut came just days after new IPO rules went into effect, designed to attract Hong Kong listings from Chinese tech companies including e-commerce titan Alibaba Group Holding Ltd"
0,"Pl Ryfors, CEO, Episurf MedicalAbout Episurf Medical Episurf Medical is endeavoring to bring people with painful joint injuries a more active, healthier life through the availability of minimally invasive and personalized treatment alternatives"
0,"Post management uses certain non-GAAP measures, including Adjusted EBITDA, as key metrics in the evaluation of underlying Company and segment performance, in making financial, operating and planning decisions, and, in part, in the determination of cash bonuses for its executive officers and employees"
0,"Potential free cash flow yields at Leonardo in the early part of next decade look interesting, but they're some way off and it may take time for investors to revisit the stock, says Deutsche Bank"
0,PPG Says Paint Ain't Dry on $Billion Akzo Nobel Bid PPG Industries Chief Executive Michael McGarry said the Pittsburgh-based paint giant isn't ruling out a sweetened offer-or a hostile takeover-for Dutch rival Akzo Nobel
0,"Preckwinkle last week that repealing the tax would mean an 11% across-the-board cut to county services, which could affect funding to local hospitals or the county's ability to send property tax bills out on time"
0,"President Xi Jinping's administration has de-emphasized official growth targets, but that is easy when the world economy is booming and the housing market is still in the early stages of a slowdown"
0,"Price Futures Group warned that demand for sugar could soon see a short-term increase as Ramadan is ending, which could provide buying interest to restocks in Muslim countries"
0,"Prices have turned positive for the year and hit their highest level since 2012, with some traders scrambling following an LME trading suspension on metal from the world's second-largest aluminum producer, United Co"
0,Pro forma information is provided to enhance the understanding of the Company's financial performance and is reconciled to the Company's GAAP information in the accompanying tables
0,"Professor Leif Ryd, Senior Medical Advisor to Episurf Medical says: Michael Manley has held leading positions in the orthopaedic industry within research and development for more than years"
0,"Program Targets Real-Estate Technology Columbia University's Center for Urban Real Estate and MetaProp NYC, a real estate technology investment and advisory firm, are joining forces to spread technology to the real-estate industry"
0,Prosecutors say in court documents that Eni CEO Claudio Descalzi and the other executives at both Shell and Eni knew that most of the $billion Eni and Shell paid to the Nigerian government to acquire the drilling rights would be distributed as bribes
0,"Prosecutors trumpeted the fact that it was the largest-ever civil forfeiture award won at trial, and legal experts provided Risk & Compliance Journal with some lessons to draw from the verdict"
0,"Pulling off such a performance despite pressure from such a large buyer is notable, and Broadcom remains a cash machine with free cash flow surging 58% year-over-year to a new record of $billion for the quarter"
0,"Q1-Conference Call Stephen Evans, CEO, Samantha Adams, SVP, and Scott Shillington, CFO, of Pure Multi-Family, will host the conference call at 10:am (PST), 1:pm (EST), on Thursday, May 10, 2018, to review the financial results and corporate developments for the quarter ended March 31, 2018"
0,Qualcomm increased its bid for the chipmaker (http:///story/qualcomm-raises-bid-for-chip-maker-nxp-to-44-billion-2018-02-20) from $billion to $billion as Broadcom was making its push to buy Qualcomm
0,"Racial incidents have been reported at a number of other colleges this school year, including a reference to lynching at the University of Mississippi and multiple incidents involving bananas at American University in Washington, D"
0,"RBC Capital's Mitch Steves, who has a Sector Perform rating on the stock, cut his price target to $from $30, writing that his checks had suggested to him that cloud computing demand for networking is positive,  so that it's unclear if this is company specific or a demand pause for Juniper in Q3"
0,"RBS to Repurpose Dutch Banking License to Serve EU Customers: Royal Bank of Scotland swung to a net profit for the first half of 2017, as a series of one-off costs melted away"
0,"reached an agreement with creditors of its bankrupt power-generation businesses that would allow it to pull out of pursuing a more cumbersome chapter bankruptcy filing, reports The Wall Street Journal's Andrew Scurria"
0,"React said that its new management team has implemented significant cost-saving measures and better financial controls, while trading in the second half of fiscal showed signs of improvement"
0,"Realizing that their bedside manner with job applicants can affect their revenues down the line, some employers are beginning to tally the costs of unsatisfied candidates who stop patronizing their businesses or bad-mouth them to friends, said Kevin Grossman, the president of global programs at San Diego-based Talent Board LLC, a nonprofit research organization focused on recruiting"
0,Recent investigations by news outlets such as ProPublica and Buzzfeed have shown how material such as anti-Semitic content can be targeted to a sympathetic audience
0,"Red Hat is the world's leading provider of open source software solutions, using a community-powered approach to provide reliable and high-performing cloud, Linux, middleware, storage and virtualization technologies"
0,"Regarding these seven occasions, the publication continues, in which the S&P went over days without a losing session of 1%, bear markets did not take hold over the months that followed the end of the streaks, and we suspect it is going to be no different this time around"
0,"Regis Hotel in New York City, and the BioCentury Future Leaders in the Biotech Industry Conference, being held April at the Millennium Broadway Hotel & Conference Center in New York City"
0,regulators called for increased attention to cyber risks to the financial system Tuesday in the wake of the hack of the Securities and Exchange Commission's corporate filing system
0,"regulators, already grappling with defending their systems against hackers, are taking a fresh look at how to protect a vast database of stock-market trades that promises to be an even bigger target of cyberthieves"
0,"Rejecting these contracts means subcontractors will have claims against Westinghouse but it's likely that whatever they receive through bankruptcy will be less than what they would have received had work on the project continued, according to South Carolina's public utility regulator"
0,"Release: 7725-For Release: May 16, CFTC Reduces Marketplace Barriers for Global Development Initiatives Washington, DC - The Commodity Futures Trading Commission's Division of Swap Dealer and Intermediary Oversight (DSIO) today granted relief to non-US counterparties who enter into swaps with International Financial Institutions (IFIs), such as development banks"
0,"Reported Wednesday pretax profit growth of 53% for fiscal thanks to selling more homes at higher prices, backed its previous expectations, but cut its full-year dividend"
0,"Republicans backed off that idea in July under pressure from retailers and divides among GOP senators, leaving a gaping hole in the plan to drive down the corporate tax rate"
