Classification,Sentences
0,"5) The Nuclear Option Puerto Rico's creditors generally supported the federal rescue law that created Title III, reasoning that an orderly bankruptcy process was preferable to chaotic and costly litigation"
0,"63%, is a key level to watch for whether yields move higher still; for others, the move has already broken out of a downward channel for yields that has persisted for more than years"
0,"74, after Instinet's Jeffrey Kvaal this morning cut his rating on the shares to Neutral from Buy, and trimmed his price target to $from $185, after concluding gains from a supposed super cycle for the iPhone are in the late innings"
0,"8% in very active premarket trade, as the chip maker's better-than-expected results (http:///story/amd-shares-decline-even-after-earnings-beat-2017-10-24) and outlook weren't quite good enough to support recent sharp gains"
0,"A bad bet on Brexit has led to a painful December for one of this year's stand-out hedge-fund launches, the latest reflection of what is turning into another painful year for some of the industry's biggest names"
0,"A federal appeals court affirms the conviction and life sentence of Ross Ulbricht, the mastermind behind Silk Road, an online drug bazaar that was once described by the government as the most sophisticated criminal marketplace on the internet"
0,A form of power of attorney as well as the Board of Directors complete proposals and reports prepared in accordance with the Swedish Companies Act will not later than on March be available to the shareholders on the Companys website and at the Companys head office
0,"A hearing will now be scheduled for late or early to consider Premaitha's application for leave to appeal and Illumina's anticipated application for a proportion of its costs in an interim payment, the company added"
0,"A key gauge of spot trucking prices was up 31% in February, year over year, and those costs have become a frequent cause for griping by retailers and manufacturers on earnings calls"
0,"A large chunk of its tenants are startups or larger companies looking to do business with startups, so WeWork's fortunes are heavily linked with the strength of the tech sector"
0,"A lot of this capital growth has been in traditional reinsurance, but alternative capital--in the form of catastrophe bonds and related products--has more than quadrupled over the same period to $billion, or 14% of the industry total, its highest share ever"
0,"A Mary Chapin Carpenter song becomes a pre-teen's wake-up call about female roles Whitney Cummings, 35, is a comedian and actress who cocreated the CBS sitcom Broke Girls"
0,"A MTGEP Marriott International MAR 129,Marvell Tech Group MRVL 1,142,Maxim Integrated Products MXIM 58,Medidata Solutions MDSO 3,Microchip Technology MCHP 45,NCS Multistage NCSM 27,NICE ADR NICE 36,National Beverage FIZZ 16,Netflix NFLX 1,412,Novanta NOVT 10,Ollie's Bargain Outlet OLLI 16,PTC Inc"
0,"A new North Star plan faces this music: we think improved speed, additional merchandise unique to Macy's, more love, & fashion authority are critical factors ahead in the intense battle to stabilize and re-gain market share vs"
0,"A P&G spokesman said the consumer products giant is reviewing data from both electronically cast votes and paper proxy cards and, based on the findings, will decide whether to challenge the results compiled by IVS Associates Inc"
0,"A quantitative review of retail-stock behavior suggested that companies with high sales-per-employee showed above-market returns even as the broader sector struggled, said analysts at brokerage Morgan Stanley, in a research note"
0,"A range of to months from today and a price rise to around 3,to 3,on the S&P would show the same 60% gain over months as the least of the other classic bubble events"
0,"A reasonable fact finder could conclude that Gillette had deliberately brought baseless claims in an attempt to bully ShaveLogic out of the market, Justice Salinger wrote"
0,"A significant amount of data has been collected on the growing cohort of Episealer patients, with the first patient still performing very well, nearly years since the treatment"
0,"A song by The Who comforts a teenager struggling with his parents' divorce David Cieri, 43, is a multi-instrumentalist and composer who has scored seven of Ken Burns's documentary films"
0,"A South Korean presidential aide told reporters that Trade Minister Kim Hyun-chong, who is on an extended visit to Washington, was engaged in fierce and intense talks with the U"
0,"A spokesman for China's Commerce Ministry said last month that a preliminary review of the NXP deal had turned up related issues that are hard to resolve, making it difficult to eliminate the negative impact"
0,"A Starbucks spokeswoman referred a request for comment to the National Coffee Association, which said the coffee industry is considering potential appeals or further legal options"
0,A tick of a reprieve came on Wednesday and Thursday with the CME boards trading higher for two consecutive days and local auctions across the Midwest saw higher prices for feeder cattle the first time in about two weeks
0,"A US cargo of liquefied natural gas was substituted for Qatari LNG earlier this month, after a major political split emerged between Qatar and the Gulf Co-operation Council nations of Saudi Arabia, UAE, and others"
0,"A week ahead of its next policy meeting, the European Central Bank is expected to receive mixed news from the European Union's statistics agency, with both unemployment and inflation falling"
0,"A year later the company tried to sell the stomach-drug business to Takeda Pharmaceutical for less than what they bought it for, in an effort to build cash and pay down its then-$billion in debt, but the deal fell apart when the companies couldn't come to terms on price"
0,"A), JPMorgan (JPM) and Amazon (AMZN) announced the formation of an independent company that is free from profit-making incentives and constraints, saying: The initial focus of the new company will be on technology solutions that will provide U"
0,ABB Lowers Expected Impact From Korean Theft by $Million Switzerland's ABB lowered the estimated financial damage related to a fraud and embezzlement scheme at its South Korean unit by $million on expected insurance-related recoveries
0,Abercrombie & Fitch shares fell by more than 20% after the teen retailer disclosed that it was abandoning efforts to sell itself and would try to revive its fortunes as a standalone entity
0,"Abioye said that with marketing efforts peaking now and set to continue until early January, we hope the supply of cocoa will be higher as we move to December for the end-of-year sales"
0,"ABOUT ALCENTRA CAPITAL CORPORATION Alcentra Capital Corporation provides customized debt and equity financing solutions to lower middle-market companies, which the Company generally defines as U"
0,"About Arise Arise is one of Sweden's leading wind power companies with the business concept to develop, build and manage onshore wind farms for its own account and on behalf of investors"
0,About CRISPR Therapeutics CRISPR Therapeutics is a leading gene-editing company focused on developing transformative gene-based medicines for serious diseases using its proprietary CRISPR / Cas9 gene-editing platform
0,"About Frontier Communications Frontier Communications Corporation (NASDAQ:FTR) is a leader in providing communications services to urban, suburban, and rural communities in states"
0,About Greengro Technologies Greengro Technologies (OTC PINK:OTC:GRNH) is a world class provider of eco-friendly green technologies with specific domain expertise in indoor and outdoor agricultural science systems serving both the consumer and commercial farming markets
0,"About Mackenzie Investments Mackenzie Investments was founded in 1967, and is a leading investment management firm providing investment advisory and related services"
0,"About Northern Trust Northern Trust Corporation (Nasdaq: NTRS) is a leading provider of wealth management, asset servicing, asset management and banking to corporations, institutions, affluent families and individuals"
0,"About Perrigo Perrigo Company plc, a leading global over-the-counter (OTC) consumer goods company, offers patients and customers high quality products at affordable prices"
0,"About PG&E Pacific Gas and Electric Company, a subsidiary of PG&E Corporation (NYSE:PCG), is one of the largest combined natural gas and electric energy companies in the United States"
0,"About PG&E Pacific Gas and Electric Company, a subsidiary of PG&E Corporation (NYSE:PCG), is one of the largest combined natural gas and electric utilities in the United States"
0,"About Synaptics Incorporated Synaptics is the pioneer and leader of the human interface revolution, bringing innovative and intuitive user experiences to intelligent devices"
0,"About the Real Petfood Company - A Real Aussie heritage with a global vision Two generations ago, a hard working family with a vision started making pet food in a shed in Queensland"
0,"According to the lawsuit, the cleanup obligation made it difficult for Dune Energy to find buyers after natural gas prices fell, causing financial hardship for oil and gas drilling companies across the country"
0,"Accuses Chinese Banks, but Treads Lightly The Trump administration is struggling with how to pressure North Korea's top ally and patron-China-without alienating an economic powerhouse that is arguably the best hope to slow its rogue nuclear-weapons program"
0,Acquisition opportunities are still favourable Acquisitions are a key element of Ahlsell's business model and growth strategy and there are major synergies inherent in both complementary and strategic acquisitions
0,"Acrylamide, used for industrial processes like making paper and dyes, is also created during the cooking process for many baked and fried foods, including potato chips, bread and french fries"
0,"Actavis filed suit more than three years ago to commercialize alternative forms of pemetrexed, the active ingredient in Alimta, diluted in saline solution, claiming it wouldn't infringe on patents for Alimta in the U"
0,"Additionally, Ribbon's VNF Manager enables lifecycle management of Ribbon and third party VNFs and has been certified for Red Hat OpenStack Platform virtualized infrastructure manager"
0,Adjusted earnings of $billion as presented in this presentation represent approximately $billion of GAAP earnings minus approximately $billion of positive effects from U
0,"admissions in early November as part of a wider review of the school's programs, which will evaluate whether or not the school should shutter the full-time degree for good, while expanding on other more flexible and shorter programs"
0,"Adobe is divided into two segments, digital media and digital marketing, with the former focused on tools to create, edit, and promote digital content, and the latter offering tools for creating, measuring, analyzing, and optimizing digital advertising and marketing campaigns"
0,"After all, a big percentage of munis are issued by sanctuary cities, which number more than 30, including all the biggest cities, as well as counties across the country"
0,"After all, in our view, the more short-term justifying, the more likelihood that an unforeseen market lesson will push investors back to fundamentals, which is a good thing"
0,"After conversion, investors will get dividends from profits that have already been taxed, just like any other company, and will have to include this income in their normal tax returns"
0,"After the most expensive proxy fight in history and five weeks of counting, IVS's tally of the roughly billion votes that were cast for the October meeting found Mr"
0,"Airbus Sells Majority of Defense Electronics Business to KKR Airbus completed the sale of a majority stake in its defense electronics business to private-equity firm KKR, further helping the European plane maker shift its focus onto its growing commercial aircraft activities"
0,Allegations Against Steve Wynn Put Big Casino Project at Risk Sexual-misconduct allegations against Steve Wynn are threatening to derail Wynn Resorts's lucrative casino project in Massachusetts as regulators revisit a contentious debate on the company's license to operate in the state
0,"Also of interest, was a formal declaration that the US Onshore division is 'non-core' and the company is 'actively' looking to exit (whilst sentiment may have arrived at this point, we believe this is the first time the company has formally declared a complete exit is on the cards) - this is likely to appease domestic investors, although at this point the financial outcome remains uncertain"
0,"Also the products have achieved the relevant of the relevant countries, safety certification (for example, UL, CE, CQC) ULCECQC national certifications to ensure the product parameters are true and reliable"
0,"Also, another data point released Wednesday pointed in the opposite direction: Retail sales unexpectedly declined, indicating that the economy isn't yet overheating, at least not in retail"
0,"Also, we think US mills will benefit from higher volumes and better fixed cost absorption in as demand for steel in the US is tracking favorably, import pressures will likely remain benign as a result of recent and coming duties, and service center inventories are low"
0,"Although Argentina received scattered showers over the weekend, and the forecast there looks slightly wetter, some grain traders are betting rains won't bring significant relief to that country's already drought-diminished crop"
0,"Although the Company has attempted to identify important factors that could cause actual actions, events or results to differ materially from those described in forward-looking statements, there may be other factors that cause actions, events or results not to be as anticipated, estimated or intended"
0,"Amazon's recent merger with Whole Foods also casts a competitive shadow over Blue Apron, but Yruma sees opportunities for Blue Apron to either pair with a traditional retailer or be a compelling acquisition target given its attractive asset base"
0,"American said it has no knowledge that the government had used it to transport children affected by the policy, but said it would be extremely disappointed to learn that it is the case"
0,American said it provides travel to the federal government through contracts but that the government doesn't disclose information about the nature of the flights it takes or passengers who are traveling
0,"Amid a strong economy and the recent passage of corporate tax reform, strategists across Wall Street talked of a melt-up in stocks after the passage of tax reformthe idea that the very strongest price action in a bull market occurs near the end"
0,"Among other compliance failures, Morgan Stanley did not monitor the single-inverse ETF positions on an ongoing basis and did not ensure that certain financial advisers completed single inverse ETF training"
0,"Among other positions, she spent years with Ventadis, an independent multi-channel retail group (M6 Group) and years with the Vivendi Group where she held various positions in finance and M&A"
0,"Among the better known are the luxury Gran Hotel Manzana Kempinski and the former Ernest Hemingway haunt Hotel Ambos Mundos, two state-owned lodgings in Old Havana"
0,"Among them, investor Eric Mindich closed his $billion hedge-fund firm, Eton Park Capital Management LP, billionaire Richard Perry shuttered his hedge-fund firm and Hugh Hendry exited his flagship fund in London"
0,Among those factors which could cause actual results to differ materially are the following: market conditions and other risk factors listed from time to time in our reports filed with Canadian securities regulators on SEDAR at
0,"An early draft of an executive order on drug prices revealed yesterday, showed that the Trump Administration wasn't going to be as tough on drug pricing as promised, giving biotechnology and pharmaceutical stocks a lift"
0,An Emirati public prosecutor has issued an arrest warrant for Abraaj Group founder Arif Naqvi and a longtime associate for allegedly writing bad checks for a total of at least $million
0,An independent third-party review of interim data from the GENESIS trial confirmed Origin's conclusion that there is sufficient data to recommend a clinically effective and safe treatment time and frequency
0,"An upheaval involving any combination of Russia, Iran, Syria, North Korea or China might be just the thing to remind investors that the world, and the stock market, can be a dangerous place"
0,"Analyst Scott Van den Bosch wrote Thursday: It is unclear if the current exchange offer will be accepted by lenders, and if it is accepted, what the level of participation (high, medium, or low) will ultimately be and how substantial the improvement in the balance sheet after it's executed"
0,"Analysts expect negative or modest sales growth from a year earlier in the first quarter at three of the four most valuable biotech companiesAmgen, Biogen, and Gilead Sciences, which analysts expect will show a top-line decline of 15%"
0,"Analysts have been suspect from the start that typically-big-spending oil exploration and production companies will usher in the type of broad-based capital discipline that many investors want, and rallying oil prices add to those doubts"
0,Analysts have warned the release is an incomplete picture of China's investments in the US bond market because China can hold Treasurys in a custody account in a third country
0,"Analysts say much of this new lending has been dubious: Around a third of Australian mortgage applications contain inaccurate information, resulting in around $billion of so-called Liar Loans, according to UBS"
0,"And a lightning strike against potential rivals by Saudi crown prince Mohammed bin Salman Saturday night which left more than sixty Saudi royals and other elites in detention, including the former head of the country's National Guard"
0,"And extricating GE from the oil-services business, which only this year combined with Baker Hughes in a complex structure to protect minority shareholders, will likely take some time"
0,"And it is worth noting that sales and marketing expenses have consumed about 56% of Palo Alto's revenue for the last four quarters, compared with its outlay of 44% of revenue before it went public in mid-2012"
0,"And it wasn't because Ann Romano (Bonnie Franklin) was divorced, or that she so deftly fended off the sexual predations of her janitor, Schneider (Pat Harrington Jr"
0,"And it's probably something we need to pay attention when we hear that a rising 10-year yield will destroy the stock market, or that it won't matter, or something in between"
0,"And Switzerland-based Glencore, which reported first-half results Thursday, is betting that an electric car future will drive up demand for its key commodities zinc, cobalt, copper, nickel and coal"
0,and that they may be overestimating the earnings boost autonomous driving can provide: GM's stock is moving up sharply on the view that it can apply the tools of algorithmic driving both better and faster than anyone else in the market
0,And the European Central Bank is still waiting for signs of sustained inflation; some analysts are starting to wonder if the exit from bond purchases might not come in after all
0,"And though Judge Caproni ordered the jurors to push forward, she also said she would consider the hardships described by some individuals and may replace them with alternates"
0,"And while machines likely driving a lot of this move today, actively managed funds could become more aggressive if investors get a sense that the rally here is sustainable, Jefferies says"
0,"And while many in the investment community argue that the selling is overdone, they're also starting to acknowledge that the hit to Equifax's business will be bigger than they originally expected"
0,"And while many muni managers state a preference for essential service revenue bonds over GOs, among the largest investment grade muni open-ended funds and ETFs (by assets under management), the median allocation to GOs is 23"
0,"And while the odds of finding a great real estate fund manager are higher, the study reckons that that may be due to benchmark mismatching and asymmetry of available information"
0,"Anders has solid expertise and longstanding experience form global and listed companies, as the perfect background and qualifications for a growing company like Smart Eye"
0,"Anderson said that while a student was responsible for faking the latest threat, federal privacy laws prohibited him from disclosing the author's identity or the school's disciplinary action against that person"
0,"Animated children's series Beat Bugs, which made its debut last summer, charging the show's creators upward of $million to use the tunes as story inspiration and soundtracks"
0,"Another technique for mitigating cyber risk in the supply chain is agreeing, in contract clauses, to the triggers that signify a breach and that require notification"
0,Another thing that should make it more attractive is a pledge to simplify the numbers it reports so that investors can more easily understand them and make better forecasts
0,"Apogee customized our time-tested tools to proactively engage and assist these customers, demonstrating their energy provider cares while giving customers a sense of choice and control in their lives"
0,"Apogee's service reduces costs and increases customer satisfaction by making these customers aware of how they use energy, how they can control their energy bills, as well as making them aware of the payment options best aligned with how they are paid"
0,"Apple Agrees to Deal With Ireland Over $Billion Unpaid Tax Issue Ireland will begin collecting $billion in back taxes from Apple as soon as early next year after both sides agreed to the terms of an escrow fund for the money, Ireland's finance chief said"
0,"Apple received what it called quarterly rebates from Qualcomm under terms of the agreement, but Qualcomm began withholding those last year after Apple met with Korean regulators, the suit says"
0,"Apple's First Medical Study Signals Broader Health Ambitions Apple last week released an app that will enable it to test the Apple Watch's ability to track irregular heart rhythms as part of a study with Stanford, more evidence that Apple wants part of the $trillion U"
0,Apple's New iPhones Get a Lukewarm Reception From Buyers Estimates from two market-research firms indicate customers are buying the iPhone X and a pair of other new offerings at a rate comparable to recent models but falling short of the iPhone's peak
0,Apple's Next iPhone Will Have a Curved Screen Apple has decided to adopt a flexible OLED display for one model of the new iPhone coming out this year and has ordered sufficient components to enable mass production
0,"Aramark to Buy Avendra and AmeriPride Food-service giant Aramark plans to acquire two closely held companies for $billion, its largest deals since going public nearly four years ago"
0,"are being accused in a lawsuit of underestimating the cost of a mystery oil spill discovered after Hurricane Katrina, an error that led to the company's collapse into bankruptcy"
0,"Argentina's central bank, alarmed by the rate at which prices have been rising, moved quickly Tuesday to contain the problem by raising its benchmark interest rate by points to 26"
0,"Arguing in a federal court filing that some of the chip supplier's patents were invalid and that its business model violates patent law, the Journal's Tripp Mickle reports"
0,Arhalofenate is a potential urate-lowering anti-flare therapy that has been found to reduce painful flares in joints while at the same time lowering serum uric acid by promoting excretion of uric acid by the kidney
0,"As a result of KPMG's audit quality, the FRC said it will inspect 25% more of the firm's audits over its 2018-cycle of work and will closely monitor the implementation of its audit-quality plan"
0,"As a result, data is now raising competitive concerns especially in Europe, given data's growing role in creating and shaping markets, led by America's digital platform giants"
0,"As announced on March 13, 2017, DS Automobiles, the premium brand of PSA Group, is using the Company's Virtual Garage industry solution experience to fully support the launch of its new SUV, DS CROSSBACK, unveiled at the 87th Geneva International Motor Show"
0,"As China's latest downturn in deepened, companies already groaning under a debt burden equal to 150% of GDP were in no position to play their traditional role as stimulus engines"
0,"AS CONFEDERATE STATUES FALL, RUSSIANS REMEMBER THEIR OWN CONTROVERSIAL FIGURES Under President Vladimir Putin, enormous monuments to Russia's often painful history have been rising again"
0,"As Edward Jones Tops $Trillion in Assets, It Seeks Street Cred As regional brokerage Edward Jones presses to better compete with Wall Street titans like Merrill Lynch and Morgan Stanley, client assets have passed the $trillion mark"
0,"As for Neptune's involvement in krill oil, it will continue to offer market ready finished products, such as its krill oil soft gel capsules via its Solutions Business in partnership with Aker BioMarine"
0,"As gamers increasingly choose digital downloads over physical videogame discs, GameStop has tried to add new components to its business, including prepaid phones, collectibles, and Apple products"
0,"As the Disposal was executed during the offer period, pursuant to Rule of the Takeovers Code, it is considered a frustrating action and is subject to Shareholders' approval in a general meeting of the Company"
